{
  "generatedAt": "2026-06-04T06:57:47.671909Z",
  "sample": false,
  "environment": {
    "cpu": "Apple M3",
    "cores": 8,
    "ramGb": 17.2,
    "os": "macOS 26.5",
    "java": "openjdk version 25.0.3 2026-04-21 LTS",
    "graalvm": "",
    "springBoot": "4.0.0",
    "quarkus": "3.17.5",
    "containerLimits": {
      "cpus": 4,
      "memory": "2g",
      "cpuset": "0,1,2,3"
    }
  },
  "variants": [
    {
      "id": "spring-vt-jvm",
      "label": "Spring Boot 4 · Virtual Threads · JVM",
      "stack": "spring-boot-4",
      "paradigm": "virtual-threads",
      "packaging": "jvm",
      "ingestMode": "http",
      "supported": true,
      "notes": "",
      "metrics": {
        "throughputRps": {
          "median": 9988.5,
          "stddev": 0.0,
          "runs": [
            9988.5
          ]
        },
        "latencyMs": {
          "p50": 2.93,
          "p95": 29.39,
          "p99": 208.39,
          "p999": 606.47
        },
        "errorRatePct": {
          "median": 0
        },
        "startupMs": {
          "median": 2516.72,
          "stddev": 0.0,
          "runs": [
            2516.72
          ]
        },
        "timeToFirstReqMs": {
          "median": 2778.63
        },
        "warmupToStableMs": {
          "median": 1273.87
        },
        "idleRssMb": {
          "median": 373.61,
          "stddev": 0.0,
          "runs": [
            373.61
          ]
        },
        "underLoadRssMb": {
          "median": 498.4
        },
        "underLoadCpuPct": {
          "median": 253.6
        },
        "imageSizeMb": {
          "value": 165.4
        },
        "efficiency": {
          "rpsPerMb": 20.04,
          "rpsPerCpuPct": 39.39
        }
      }
    },
    {
      "id": "quarkus-reactive-jvm",
      "label": "Quarkus · Reactive (Mutiny) · JVM",
      "stack": "quarkus",
      "paradigm": "reactive",
      "packaging": "jvm",
      "ingestMode": "http",
      "supported": true,
      "notes": "",
      "metrics": {
        "throughputRps": {
          "median": 11874.0,
          "stddev": 0.0,
          "runs": [
            11874.0
          ]
        },
        "latencyMs": {
          "p50": 4.04,
          "p95": 20.21,
          "p99": 210.32,
          "p999": 602.46
        },
        "errorRatePct": {
          "median": 0
        },
        "startupMs": {
          "median": 1174.15,
          "stddev": 0.0,
          "runs": [
            1174.15
          ]
        },
        "timeToFirstReqMs": {
          "median": 1417.52
        },
        "warmupToStableMs": {
          "median": 1260.26
        },
        "idleRssMb": {
          "median": 248.62,
          "stddev": 0.0,
          "runs": [
            248.62
          ]
        },
        "underLoadRssMb": {
          "median": 341.1
        },
        "underLoadCpuPct": {
          "median": 280.5
        },
        "imageSizeMb": {
          "value": 150.8
        },
        "efficiency": {
          "rpsPerMb": 34.81,
          "rpsPerCpuPct": 42.33
        }
      }
    },
    {
      "id": "quarkus-reactive-native",
      "label": "Quarkus · Reactive (Mutiny) · Native",
      "stack": "quarkus",
      "paradigm": "reactive",
      "packaging": "native",
      "ingestMode": "http",
      "supported": true,
      "notes": "",
      "metrics": {
        "throughputRps": {
          "median": 11808.2,
          "stddev": 0.0,
          "runs": [
            11808.2
          ]
        },
        "latencyMs": {
          "p50": 5.45,
          "p95": 22.53,
          "p99": 211.07,
          "p999": 318.33
        },
        "errorRatePct": {
          "median": 0
        },
        "startupMs": {
          "median": 341.05,
          "stddev": 0.0,
          "runs": [
            341.05
          ]
        },
        "timeToFirstReqMs": {
          "median": 415.44
        },
        "warmupToStableMs": {
          "median": 472.12
        },
        "idleRssMb": {
          "median": 68.09,
          "stddev": 0.0,
          "runs": [
            68.09
          ]
        },
        "underLoadRssMb": {
          "median": 62.1
        },
        "underLoadCpuPct": {
          "median": 303.6
        },
        "imageSizeMb": {
          "value": 60.6
        },
        "efficiency": {
          "rpsPerMb": 190.15,
          "rpsPerCpuPct": 38.89
        }
      }
    },
    {
      "id": "quarkus-imperative-jvm",
      "label": "Quarkus · Imperative (blocking) · JVM",
      "stack": "quarkus",
      "paradigm": "imperative",
      "packaging": "jvm",
      "ingestMode": "http",
      "supported": true,
      "notes": "",
      "metrics": {
        "throughputRps": {
          "median": 8400.5,
          "stddev": 0.0,
          "runs": [
            8400.5
          ]
        },
        "latencyMs": {
          "p50": 9.12,
          "p95": 42.32,
          "p99": 214.63,
          "p999": 607.49
        },
        "errorRatePct": {
          "median": 0
        },
        "startupMs": {
          "median": 1627.97,
          "stddev": 0.0,
          "runs": [
            1627.97
          ]
        },
        "timeToFirstReqMs": {
          "median": 1827.43
        },
        "warmupToStableMs": {
          "median": 1071.15
        },
        "idleRssMb": {
          "median": 385.14,
          "stddev": 0.0,
          "runs": [
            385.14
          ]
        },
        "underLoadRssMb": {
          "median": 529.2
        },
        "underLoadCpuPct": {
          "median": 358.8
        },
        "imageSizeMb": {
          "value": 170.1
        },
        "efficiency": {
          "rpsPerMb": 15.87,
          "rpsPerCpuPct": 23.41
        }
      }
    }
  ]
}