{
  "generatedAt": "2026-06-04T00:21:48.166079Z",
  "sample": false,
  "environment": {
    "cpu": "Apple M3",
    "cores": 8,
    "ramGb": 17.2,
    "os": "macOS 26.5",
    "java": "openjdk version 25.0.3 2026-04-21 LTS",
    "graalvm": "",
    "springBoot": "4.0.0",
    "quarkus": "3.17.5",
    "containerLimits": {
      "cpus": 1,
      "memory": "512m",
      "cpuset": "0"
    }
  },
  "variants": [
    {
      "id": "spring-vt-jvm",
      "label": "Spring Boot 4 · Virtual Threads · JVM",
      "stack": "spring-boot-4",
      "paradigm": "virtual-threads",
      "packaging": "jvm",
      "ingestMode": "http",
      "supported": true,
      "notes": "",
      "metrics": {
        "throughputRps": {
          "median": 5945.6,
          "stddev": 0.0,
          "runs": [
            5945.6
          ]
        },
        "latencyMs": {
          "p50": 18.44,
          "p95": 56.67,
          "p99": 83.48,
          "p999": 178.49
        },
        "errorRatePct": {
          "median": 0
        },
        "startupMs": {
          "median": 3916.43,
          "stddev": 0.0,
          "runs": [
            3916.43
          ]
        },
        "timeToFirstReqMs": {
          "median": 4302.03
        },
        "warmupToStableMs": {
          "median": 2648.94
        },
        "idleRssMb": {
          "median": 318.56,
          "stddev": 0.0,
          "runs": [
            318.56
          ]
        },
        "underLoadRssMb": {
          "median": 425.0
        },
        "underLoadCpuPct": {
          "median": 96.5
        },
        "imageSizeMb": {
          "value": 165.4
        },
        "efficiency": {
          "rpsPerMb": 13.99,
          "rpsPerCpuPct": 61.61
        }
      }
    },
    {
      "id": "spring-vt-native",
      "label": "Spring Boot 4 · Virtual Threads · Native",
      "stack": "spring-boot-4",
      "paradigm": "virtual-threads",
      "packaging": "native",
      "ingestMode": "http",
      "supported": true,
      "notes": "",
      "metrics": {
        "throughputRps": {
          "median": 7280.9,
          "stddev": 0.0,
          "runs": [
            7280.9
          ]
        },
        "latencyMs": {
          "p50": 18.99,
          "p95": 29.84,
          "p99": 43.59,
          "p999": 81.12
        },
        "errorRatePct": {
          "median": 0
        },
        "startupMs": {
          "median": 352.88,
          "stddev": 0.0,
          "runs": [
            352.88
          ]
        },
        "timeToFirstReqMs": {
          "median": 425.35
        },
        "warmupToStableMs": {
          "median": 580.13
        },
        "idleRssMb": {
          "median": 112.51,
          "stddev": 0.0,
          "runs": [
            112.51
          ]
        },
        "underLoadRssMb": {
          "median": 206.5
        },
        "underLoadCpuPct": {
          "median": 94.8
        },
        "imageSizeMb": {
          "value": 84.9
        },
        "efficiency": {
          "rpsPerMb": 35.26,
          "rpsPerCpuPct": 76.8
        }
      }
    },
    {
      "id": "spring-webflux-jvm",
      "label": "Spring Boot 4 · WebFlux · JVM",
      "stack": "spring-boot-4",
      "paradigm": "webflux",
      "packaging": "jvm",
      "ingestMode": "http",
      "supported": false,
      "notes": "Starts (health 200) but ingestion fails (~96% errors) — not functionally supported.",
      "metrics": null
    },
    {
      "id": "quarkus-reactive-jvm",
      "label": "Quarkus · Reactive (Mutiny) · JVM",
      "stack": "quarkus",
      "paradigm": "reactive",
      "packaging": "jvm",
      "ingestMode": "http",
      "supported": true,
      "notes": "",
      "metrics": {
        "throughputRps": {
          "median": 9382.6,
          "stddev": 0.0,
          "runs": [
            9382.6
          ]
        },
        "latencyMs": {
          "p50": 13.77,
          "p95": 29.22,
          "p99": 41.92,
          "p999": 102.52
        },
        "errorRatePct": {
          "median": 0
        },
        "startupMs": {
          "median": 1817.51,
          "stddev": 0.0,
          "runs": [
            1817.51
          ]
        },
        "timeToFirstReqMs": {
          "median": 2159.99
        },
        "warmupToStableMs": {
          "median": 1946.2
        },
        "idleRssMb": {
          "median": 239.29,
          "stddev": 0.0,
          "runs": [
            239.29
          ]
        },
        "underLoadRssMb": {
          "median": 278.0
        },
        "underLoadCpuPct": {
          "median": 92.6
        },
        "imageSizeMb": {
          "value": 150.8
        },
        "efficiency": {
          "rpsPerMb": 33.75,
          "rpsPerCpuPct": 101.32
        }
      }
    },
    {
      "id": "quarkus-reactive-native",
      "label": "Quarkus · Reactive (Mutiny) · Native",
      "stack": "quarkus",
      "paradigm": "reactive",
      "packaging": "native",
      "ingestMode": "http",
      "supported": true,
      "notes": "",
      "metrics": {
        "throughputRps": {
          "median": 9692.8,
          "stddev": 0.0,
          "runs": [
            9692.8
          ]
        },
        "latencyMs": {
          "p50": 14.54,
          "p95": 22.99,
          "p99": 27.84,
          "p999": 47.98
        },
        "errorRatePct": {
          "median": 0
        },
        "startupMs": {
          "median": 326.43,
          "stddev": 0.0,
          "runs": [
            326.43
          ]
        },
        "timeToFirstReqMs": {
          "median": 402.86
        },
        "warmupToStableMs": {
          "median": 580.13
        },
        "idleRssMb": {
          "median": 74.51,
          "stddev": 0.0,
          "runs": [
            74.51
          ]
        },
        "underLoadRssMb": {
          "median": 74.6
        },
        "underLoadCpuPct": {
          "median": 92.1
        },
        "imageSizeMb": {
          "value": 60.6
        },
        "efficiency": {
          "rpsPerMb": 129.93,
          "rpsPerCpuPct": 105.24
        }
      }
    },
    {
      "id": "quarkus-imperative-jvm",
      "label": "Quarkus · Imperative (blocking) · JVM",
      "stack": "quarkus",
      "paradigm": "imperative",
      "packaging": "jvm",
      "ingestMode": "http",
      "supported": true,
      "notes": "",
      "metrics": {
        "throughputRps": {
          "median": 3640.9,
          "stddev": 0.0,
          "runs": [
            3640.9
          ]
        },
        "latencyMs": {
          "p50": 36.37,
          "p95": 77.47,
          "p99": 125.47,
          "p999": 300.63
        },
        "errorRatePct": {
          "median": 0
        },
        "startupMs": {
          "median": 2403.94,
          "stddev": 0.0,
          "runs": [
            2403.94
          ]
        },
        "timeToFirstReqMs": {
          "median": 2635.06
        },
        "warmupToStableMs": {
          "median": 2600.43
        },
        "idleRssMb": {
          "median": 284.27,
          "stddev": 0.0,
          "runs": [
            284.27
          ]
        },
        "underLoadRssMb": {
          "median": 415.6
        },
        "underLoadCpuPct": {
          "median": 96.7
        },
        "imageSizeMb": {
          "value": 170.1
        },
        "efficiency": {
          "rpsPerMb": 8.76,
          "rpsPerCpuPct": 37.65
        }
      }
    },
    {
      "id": "quarkus-imperative-native",
      "label": "Quarkus · Imperative (blocking) · Native",
      "stack": "quarkus",
      "paradigm": "imperative",
      "packaging": "native",
      "ingestMode": "http",
      "supported": true,
      "notes": "",
      "metrics": {
        "throughputRps": {
          "median": 7649.7,
          "stddev": 0.0,
          "runs": [
            7649.7
          ]
        },
        "latencyMs": {
          "p50": 16.98,
          "p95": 34.31,
          "p99": 44.46,
          "p999": 64.78
        },
        "errorRatePct": {
          "median": 0
        },
        "startupMs": {
          "median": 374.6,
          "stddev": 0.0,
          "runs": [
            374.6
          ]
        },
        "timeToFirstReqMs": {
          "median": 440.8
        },
        "warmupToStableMs": {
          "median": 606.51
        },
        "idleRssMb": {
          "median": 179.94,
          "stddev": 0.0,
          "runs": [
            179.94
          ]
        },
        "underLoadRssMb": {
          "median": 275.4
        },
        "underLoadCpuPct": {
          "median": 93.0
        },
        "imageSizeMb": {
          "value": 69.6
        },
        "efficiency": {
          "rpsPerMb": 27.78,
          "rpsPerCpuPct": 82.25
        }
      }
    }
  ]
}